{
  "schemaVersion": "1.0",
  "sessionId": "44444444-4444-4444-8444-444444444441",
  "connectorId": "44444444-4444-4444-8444-444444444442",
  "pharmacyDisplayName": "Pharma Auto Synthetic Pharmacy",
  "baseUrl": "https://192.0.2.10:7443",
  "certificateSha256": "0123456789ABCDEF0123456789ABCDEF0123456789ABCDEF0123456789ABCDEF",
  "oneTimeSecret": "Phase1SyntheticPairingSecret_123456",
  "expiresAt": "2026-08-21T12:05:00Z"
}
